### ISSUE TITLE
关于抓包后结果的分析

### ISSUE THREAD

**Issue by offzen** [ibsgss/TcpQuality#7]
[tcpdump-1.log](https://github.com/user-attachments/files/30308302/tcpdump-1.log)
**协议级异常**。
以下是AI对这部分内容的分析。
---

## 抓包日志中的 4 大致命 SYN 异常分析

观察这 300 行日志，发现 `nping` 探针程序在发包时存在**非常不规范的底层网络行为**：

### 异常 1：SYN 报文竟然携带了 1156 字节的 Payload（最核心死因）

* **抓包特征：**
```text
Out IP ...: Flags [S], seq ..., length 1156: HTTP

```

* **深度分析：**
在标准 TCP 协议中，三次握手的第一个 `SYN` 包**数据长度必须为 0 (`length 0`)**。
但从日志看，`nping` 在发送 `SYN` 的同时，硬生生在握手包里塞入了 **1156 字节的 HTTP Payload 数据**！
* **后果：**
现代 CDN（如网宿、腾讯云 CDN、对象存储等）和运营商骨干网防火墙，对这种“带有大体积 Payload 的 SYN 包”有极强的 DDoS / 畸形包防御策略。**90% 的云厂商防火墙看到这种包会直接静默丢弃（Drop）或返回 RST**。

---

### 异常 2：收到大量 `ICMP time exceeded in-transit`（TTL 半路耗尽）

* **抓包特征：**
```text

In IP 207.45.218.210 > ...: ICMP time exceeded in-transit
In IP 219.158.3.141 > ...: ICMP time exceeded in-transit
In IP 113.207.25.130 > ...: ICMP time exceeded in-transit

```

* **深度分析：**
沿途的路由器（如 `219.158.3.141` 联通骨干网节点）频繁回应“超时”。
* **原因：**
`nping` 在发起探测时，设置的发包 **IP TTL（生存时间）过小**（例如 TTL=1, 2, 3... 类似于 Traceroute 行为）。数据包在骨干网路由跳数还没走完时 TTL 就清零了，根本没有抵达目标 CDN 节点就被中间路由器给扔掉了。

---

### 异常 3：客户端“收到 SYN-ACK 瞬间主动发 RST 拆桥”

* **抓包特征：**
```text
In  IP 119.84.169.8.80 > ...: Flags [S.]   <-- 节点回应了 SYN-ACK
Out IP ... > 119.84.169.8.80: Flags [R]    <-- 本机 0.0001 秒后主动发 RST
In  IP 119.84.169.8.80 > ...: Flags [R.]   <-- 对方被搞懵，回 RST-ACK 确认连接已断

```

* **深度分析：**
当部分节点（如 `119.84.169.8`、`36.134.64.65`、`117.185.117.109`）正常回应了三次握手第二步 `[S.]` (SYN-ACK) 时，`nping` 并没有回应 `ACK` 完成建连，而是**由本地 Linux 内核或 nping 强制发出一个 `[R]` (RST)** 强行切断连接。

---

### 异常 4：对特定 IP 的单向高频 SYN 轰炸（静默黑洞）

* **抓包特征：**
日志末尾（20:42:12 ~ 20:42:14），本机以每 **50ms 一发**的超高频率，向 `39.130.183.173:80` 连续抛出了几十个 `Flags [S]`，但**全程没有收到来自该 IP 的任何回包**。
* **深度分析：**
结合异常 1，由于发出的 SYN 包带有 1156 字节 Payload 且发包频率极高，对方节点/运营商已经触发了抗 Flood 防护，将你本机 IP（`207.x.x.x`）拉入黑名单进行**静默 DROP 拦截**。

---

## 💡 总结判定

`nping` 在这个脚本里的发包行为**严重违反了标准 TCP 握手规范**：

1. **SYN 带 Payload** 触发防护。
2. **小 TTL 发包** 导致包死在半路（产生大量 ICMP 超时）。
3. **高频半开连接** 触发安全设备的防扫描规则。

**这就 100% 解释了为什么 nping 测出来的丢包率极高**——因为它发出去的包格式本身就被远端防火墙当作“恶意攻击包”给拦截掉了，而并非真正的网络物理线路故障！

**Comment by offzen** [comment]
其中的第二，应该是预期的设计行为。通过判断任何回复来判断是成功送达。但监测点防火墙和运营商级的阻断会造成不可忽视的误差。
联通的防火墙是最宽容的 所以有些高延迟线路，丢包率显示是0或者很低，但电信和移动要严苛的多，尤其是移动，对一些知名低价机房的ASN，会故意增加延迟，所以我之前tcpping会得到1000-2000ms的回复。

**Comment by ibsgss** [comment]
@offzen 您好，这份抓包几乎都是IPv4大包探测阶段的日志。之后可以使用`--debug`后脱敏文件提供issue。

对提到的几个问题回答。
异常一：SYN携带数据是在IPv4大包探测阶段，但目前有预热机制。如果机器服务商提供了双向防火墙，经过探测有大量丢包后会用`-`替代真实数据。并且，这种情况仅存在带有高防御机器上，线路机一般不存在。
异常二：延迟探测/路由识别均采用TCP协议，沿途路由器返回的ICMP包的延迟不会被脚本统计。
异常三和异常四：与异常一的情况相同，这种情况下有预热机制，如果预热阶段存在大量丢包，当前脚本在大包探测阶段会跳过。

对于提到的“联通的防火墙是最宽容的 所以有些高延迟线路，丢包率显示是0或者很低，但电信和移动要严苛的多，尤其是移动，对一些知名低价机房的ASN，会故意增加延迟，所以我之前tcpping会得到1000-2000ms的回复。” 这是AI的误判，**请不要相信所谓对知名度低的ASN增加延迟**。目前只有高防御机器在大包探测阶段会被阻挡，剩下的行为都可以归结为线路质量问题。最好工单询问商家的防御/线路质量之后，再结合速度探测阶段的实际表现，对机器进行综合评估。

**Comment by offzen** [comment]
是的 对1000ms以上的结果判断确实是太草率了。 我以为是移动故意增加了数百毫秒不等的延迟。
这个问题比我预想的要复杂的多。谢谢。
